{
  "$schema": "../../../../docs/03-specifications/schemas/package.schema.json",
  "schemaVersion": "1.0",
  "id": "org.hase.asset.bodypart.cat-tail",
  "type": "asset",
  "version": "1.0.0",
  "name": {
    "de": "Katzenschwanz"
  },
  "description": "Stub.",
  "authors": [
    "HASE VRM MAKER"
  ],
  "license": {
    "spdx": "CC0-1.0",
    "attribution": null,
    "redistribution": true
  },
  "requires": [
    {
      "id": "org.hase.body.humanoid-mh08",
      "range": "^1.0"
    }
  ],
  "files": [],
  "dev": {
    "status": "stub"
  },
  "asset": {
    "kind": "bodypart",
    "targets": {
      "bodyInterface": {
        "id": "org.hase.iface.humanoid-mh08",
        "range": "^1.0"
      }
    },
    "occupies": [
      "back.tail"
    ],
    "fit": {
      "method": "rigid-attach",
      "mesh": "data/cat-tail.glb"
    },
    "extraBones": [
      {
        "name": "tail_01",
        "parent": "pelvis",
        "springChain": true
      },
      {
        "name": "tail_02",
        "parent": "tail_01",
        "springChain": true
      },
      {
        "name": "tail_03",
        "parent": "tail_02",
        "springChain": true
      },
      {
        "name": "tail_04",
        "parent": "tail_03",
        "springChain": true
      },
      {
        "name": "tail_05",
        "parent": "tail_04",
        "springChain": true
      },
      {
        "name": "tail_06",
        "parent": "tail_05",
        "springChain": true
      }
    ],
    "requiresCapabilities": [
      "spring-extras"
    ]
  }
}
